{
 "id": "michael-jackson--the-lady-in-my-life",
 "title": "The Lady in My Life",
 "artist": "Michael Jackson",
 "year": 1982,
 "year_note": "",
 "album": "Thriller",
 "aliases": {
  "youtube": [
   "hbjIhgk_X18"
  ],
  "apple": {
   "preview": "https://audio-ssl.itunes.apple.com/itunes-assets/AudioPreview221/v4/c1/1d/f9/c11df9ff-ae6a-7c39-9102-62e0b83b14b4/mzaf_10649929995235674377.plus.aac.p.m4a",
   "url": "https://music.apple.com/us/album/the-lady-in-my-life/269572838?i=269573478&uo=4"
  }
 },
 "notes": {
  "made": "Temperton wrote and arranged it, the slow closer of Thriller, cut at Westlake with Louis Johnson on bass, Jeff Porcaro on drums, Paul Jackson Jr. on guitar, Greg Phillinganes on Rhodes, David Paich and Steve Porcaro on synths and Michael Boddicker on Emulator. In his memoir Moonwalk, Jackson wrote that Jones still wasn't happy after dozens of takes and told him to beg, so he had the lights turned off and the curtain closed and sang it again; that take is the record. An extra verse and chorus were cut, and the longer version surfaced on a 2002 Temperton compilation.",
  "context": "It closes the album, and J. Randy Taraborrelli called it the closest Jackson had come to crooning a sexy, soulful ballad since his Motown years. It was the only one of the nine songs never issued as a single in any form, and Jackson never sang it live. Its second life came through hip-hop and R&B producers, who kept sampling it, usually pitched up.",
  "listen_for": [
   {
    "where": "underneath the whole song",
    "note": "Louis Johnson of the Brothers Johnson on bass, with Jeff Porcaro of Toto on drums."
   },
   {
    "where": "the lead vocal, start to finish",
    "note": "The take Jackson sang in the dark after Jones asked him to beg."
   }
  ],
  "leads_to": {
   "artist": "LL Cool J featuring Boyz II Men",
   "title": "Hey Lover",
   "year": 1995,
   "why": "Built on this song, so Temperton has a writing credit; number 3 on the Hot 100 and the R&B chart, and a Grammy for Best Rap Solo Performance."
  },
  "sources": [
   "https://en.wikipedia.org/wiki/The_Lady_in_My_Life",
   "https://www.thriller40.com/music/the-lady-in-my-life/",
   "https://therunoutgrooves.substack.com/p/lets-make-this-a-night-we-wont-forget",
   "https://en.wikipedia.org/wiki/Thriller_(album)",
   "https://en.wikipedia.org/wiki/Hey_Lover"
  ],
  "unverified": "I didn't check whether Guitar Man has its own Wikipedia article. The Moonwalk account comes through a Substack quoting it, not the book."
 },
 "culture": [
  {
   "kind": "sample",
   "title": "Hey Lover",
   "line": "LL Cool J and Boyz II Men's 1995 single samples it and reached number 3 on the Hot 100; Angie Stone's Lover's Ghetto and Chris Brown's Transparency use it too.",
   "wiki": "Hey_Lover",
   "source": "https://en.wikipedia.org/wiki/Hey_Lover"
  },
  {
   "kind": "cover",
   "title": "Benson's guitar",
   "line": "George Benson's instrumental from Guitar Man (2011) spent two weeks at number one on Billboard's Smooth Jazz Airplay chart in February 2012.",
   "wiki": "Guitar_Man_(George_Benson_album)",
   "source": "https://en.wikipedia.org/wiki/The_Lady_in_My_Life"
  },
  {
   "kind": "live",
   "title": "Maxwell, 2022",
   "line": "Jackson never sang it live; Maxwell did, at the 2022 Billboard Music Awards to open the Thriller 40 celebrations.",
   "wiki": "",
   "source": "https://www.thriller40.com/music/the-lady-in-my-life/"
  }
 ],
 "review": {
  "state": "draft",
  "by": null,
  "date": null
 },
 "provenance": {
  "ai_generated": true,
  "model": "Claude (Anthropic), research agents with web search",
  "written_by": "Liner Notes era writer (rod-temperton, era-4)",
  "written_on": "2026-10-20"
 }
}
