{
 "id": "curiosity-killed-the-cat--down-to-earth",
 "title": "Down to Earth",
 "artist": "Curiosity Killed the Cat",
 "year": 1986,
 "year_note": "Released November 1986; it climbed slowly and spent three weeks at 3 in February 1987.",
 "album": "Keep Your Distance",
 "aliases": {
  "youtube": [
   "9cZQcQw4mDE"
  ],
  "apple": {
   "preview": "https://audio-ssl.itunes.apple.com/itunes-assets/AudioPreview221/v4/4e/82/e1/4e82e154-4afd-06ce-9084-50333d4cfef5/mzaf_16501491971948855530.plus.aac.p.m4a",
   "url": "https://music.apple.com/gb/album/down-to-earth/1442583937?i=1442584259&uo=4"
  }
 },
 "notes": {
  "made": "Stewart Levine, who had produced Simply Red's Picture Book, the Crusaders and Hugh Masekela, was brought in to rescue the debut after sessions with Sly & Robbie, Paul Staveley O'Duffy and Culture Club's Roy Hay were abandoned. He produced six of the album's tracks, this one included. The band (Ben Volpeliere-Pierrot, Julian Brookhouse, Nick Thorp and Migi Drummond) wrote it with session keyboard player Toby Andersen, who co-wrote ten songs and was let go three months after the album came out.",
  "context": "'Misfit', the first single, had stiffed in August 1986 despite a video with Andy Warhol in it. Mercury wanted to hold the next single until after Christmas; the band insisted on November, and it crept up the chart for three months. In April 1987 Keep Your Distance went in at number 1. Smash Hits called the singer 'Ben Vol-au-vent Parrot', and his beret was really a fisherman's cap worn back to front.",
  "listen_for": [
   {
    "where": "Volpeliere-Pierrot's vocal",
    "note": "A light baritone, as one retrospective put it, kept cool over a rhythm section that knows where the one is."
   }
  ],
  "leads_to": {
   "artist": "Hugh Masekela",
   "title": "Grazing in the Grass",
   "year": 1968,
   "why": "Stewart Levine produced it, a US number 1, eighteen years before he took on a band of South-West London lads in hats."
  },
  "sources": [
   "https://en.wikipedia.org/wiki/Down_to_Earth_(Curiosity_Killed_the_Cat_song)",
   "https://en.wikipedia.org/wiki/Keep_Your_Distance",
   "https://en.wikipedia.org/wiki/Curiosity_Killed_the_Cat",
   "https://movingtheriver.com/2017/04/15/curiosity-killed-the-cat-keep-your-distance-30-years-on/",
   "https://en.wikipedia.org/wiki/Stewart_Levine",
   "https://en.wikipedia.org/wiki/Picture_Book_(Simply_Red_album)",
   "https://en.wikipedia.org/wiki/Grazing_in_the_Grass"
  ],
  "unverified": "I couldn't find session players, horn credits or any description of this track's arrangement, so there is only one listen note, and it describes the band generally. Desmond's 'UK #3' is right."
 },
 "culture": [
  {
   "kind": "chart",
   "title": "Three weeks at 3",
   "line": "Mercury wanted to wait until after Christmas; the band insisted on November 1986, and the single climbed until it spent three weeks at 3 in February 1987.",
   "wiki": "Down_to_Earth_(Curiosity_Killed_the_Cat_song)",
   "source": "https://en.wikipedia.org/wiki/Down_to_Earth_(Curiosity_Killed_the_Cat_song)"
  },
  {
   "kind": "chart",
   "title": "Straight in at number 1",
   "line": "Keep Your Distance entered the UK album chart at number 1 in April 1987 and stayed in the top ten for 13 weeks.",
   "wiki": "Keep_Your_Distance",
   "source": "https://en.wikipedia.org/wiki/Curiosity_Killed_the_Cat"
  }
 ],
 "review": {
  "state": "draft",
  "by": null,
  "date": null
 },
 "provenance": {
  "ai_generated": true,
  "model": "Claude (Anthropic), research agents with web search",
  "written_by": "journeys pilot era writer (sophisti-pop, era-4)",
  "written_on": "2026-10-18"
 }
}
