{
 "id": "roxy-music--more-than-this",
 "title": "More Than This",
 "artist": "Roxy Music",
 "year": 1982,
 "year_note": "",
 "album": "Avalon",
 "aliases": {
  "youtube": [
   "kOnde5c7OG8"
  ],
  "apple": {
   "preview": "https://audio-ssl.itunes.apple.com/itunes-assets/AudioPreview221/v4/b9/36/7b/b9367b55-1020-2d34-640c-ca0b54ed5cd1/mzaf_11272239635944078517.plus.aac.p.m4a",
   "url": "https://music.apple.com/us/album/more-than-this/723875837?i=723876319&uo=4"
  }
 },
 "notes": {
  "made": "Ferry wrote it, and it came out of the same sessions as the rest of Avalon: Chertsey, Compass Point, then the Power Station with Bob Clearmountain, Rhett Davies producing. Ferry plays keyboards, with Manzanera on lead guitar, Neil Hubbard on second guitar, Alan Spenner on bass, Andy Newmark on drums, Jimmy Maelen on percussion and Fonzi Thornton on backing vocals.",
  "context": "Released in March 1982 ahead of the album, it got to number 6, Roxy's last UK top ten. Ferry has said the west of Ireland, where he started writing, is where the album's dark melancholy came from. The sleeve is Rossetti's 1872 painting Veronica Veronese. In America it barely registered (103 on the pop chart) until Bill Murray mumbled it at a Tokyo karaoke bar in Lost in Translation in 2003.",
  "listen_for": [
   {
    "where": "the last stretch, after Ferry stops singing",
    "note": "His vocal ends with well over a minute and a half still to run, and the song turns into a synthesizer instrumental. A pop single that gives its last third to the band was unusual then and is the reason it drifts rather than ends."
   },
   {
    "where": "behind the choruses",
    "note": "Fonzi Thornton sings the backing parts, as he does on most of Avalon, and he is a big part of its soul-record polish."
   }
  ],
  "leads_to": {
   "artist": "Air",
   "title": "Alone in Kyoto",
   "year": 2003,
   "why": "It sits on the same Lost in Translation soundtrack as Bill Murray's 'More Than This' (his karaoke take is a hidden track at the end of the CD), and it is the French end of the same late-night drift."
  },
  "sources": [
   "https://en.wikipedia.org/wiki/More_than_This_(Roxy_Music_song)",
   "https://en.wikipedia.org/wiki/Avalon_(Roxy_Music_album)",
   "https://en.wikipedia.org/wiki/Lost_in_Translation_(soundtrack)"
  ],
  "unverified": "Desmond's Lost in Translation claim checks out. I left out any US Hot 100 position: the album article gives 103, and the song article only gives 58 on the rock chart."
 },
 "culture": [
  {
   "kind": "chart",
   "title": "UK number 6",
   "line": "Released in March 1982 ahead of the album, it got to 6, Roxy Music's last UK top ten. The sleeve is Rossetti's 1872 painting Veronica Veronese.",
   "wiki": "More_than_This_(Roxy_Music_song)",
   "source": "https://en.wikipedia.org/wiki/More_than_This_(Roxy_Music_song)"
  },
  {
   "kind": "screen",
   "title": "Lost in Translation",
   "line": "Bill Murray's tired karaoke version in Sofia Coppola's 2003 film, picked by Coppola and Murray during the shoot, hides at the end of the soundtrack CD.",
   "wiki": "Lost_in_Translation_(film)",
   "source": "https://en.wikipedia.org/wiki/Lost_in_Translation_(soundtrack)"
  }
 ],
 "review": {
  "state": "draft",
  "by": null,
  "date": null
 },
 "provenance": {
  "ai_generated": true,
  "model": "Claude (Anthropic), research agents with web search",
  "written_by": "journeys pilot era writer (sophisti-pop, era-1)",
  "written_on": "2026-10-19"
 }
}
